data_id,title,content,source_link,datetime_published,image_url,status
news/market/30202268/,PayPal Integrated into Paybis as Trump Appoints David Sacks AI & Crypto Czar,"Paybis, a cryptocurrency exchange and onramp provider, has integrated PayPal, a widely used online payment system, into its platform to enhance security, accessibility, and ease of use for crypto transactions.
At the same time, US President-elect Donald Trump announced the appointment of former PayPal Chief Operating Officer, David Sacks, as his ""White House A.I. & Crypto Czar.""
Paybis Integrates PayPal for Crypto
The service is currently available in the European Economic Area (EEA) and the UK, excluding Hungary, Croatia, and Iceland. Paybis plans to expand to new regions based on market demand and regulatory compliance.
This integration allows users to tap into PayPal's 430 million global users and its familiar interface, simplifying crypto purchases for newcomers.
Compared to traditional payment methods like credit and debit cards, PayPal's infrastructure offers higher reliability and a better transaction success rate, often avoiding the fraud checks, user errors, and bank declines that hinder other methods. This contributes to increased user confidence when buying cryptocurrencies on Paybis.
Trump Claims Credit for Bitcoin Surge
The appointment of Sacks is part of Trump's effort to reshape US policy on digital currency. His incoming administration, including officials from the Securities and Exchange Commission and the Commodity Futures Trading Commission, is expected to influence the future of US cryptocurrency policy.
Trump’s tech supporters advocate for minimal regulation in sectors like artificial intelligence and cryptocurrency, arguing that excessive rules could stifle innovation.
Bitcoin surpassed the $100,000 all-time price level last week, a milestone that stirred the crypto community and elicited a response from President-elect Trump, as reported by Finance Magnates.
Trump took to his social media platform, Truth Social, to claim credit for the achievement, which he suggested was partly driven by his appointment of pro-crypto SEC chair, Paul Atkins.
“CONGRATULATIONS BITCOINERS!!! $100,000!!! YOU’RE WELCOME!!! Together, we will Make America Great Again!” Trump wrote, attributing the cryptocurrency’s historic surge to his administration's pro-crypto approach.",https://www.financemagnates.com/cryptocurrency/paypal-integrated-into-paybis-as-trump-appoints-david-sacks-ai-crypto-czar/?utm_source=CryptoNews&utm_medium=app,2024-12-09 22:10:12.382931,https://cnews24.ru/uploads/d50/d50a5d3114f95926641bc86ccfb52843a866f18a.jpg,Successfully Scraped
news/ethereum/30202811/,Whale doubles down on ETH with $7m buy,"On-chain data reveals that a whale has increased their Eehereum holdings with a substantial purchase.
According to Lookonchain, the whale, who already held millions of dollars worth of Ethereum (ETH) accumulated over recent months, made a 1,800 ETH purchase valued at $7 million. This acquisition occurred as the price of Ether hovered near $3,900.
Lookonchain shared the whale’s transaction via a post on X.
This whale has been actively accumulating Ethereum since May 24, amassing 39,600 ETH in total over several months. With the recent addition, the total investment value has reached approximately $99 million, bringing the whale’s average purchase price to $2,487 per coin.
Read more:
Ethereum reached $4k as retail accumulation strengthens
The whale’s bullish view on the altcoin saw them acquire over 6,800 ETH in four transactions in the past four months. Overall, the acquisitions currently put their unrealized profit at $54 million.
Something noteworthy about this whale is that they held as some took a bearish view with huge net inflows in September. As Ether price fell to lows of $2,200, data from IntoTheBlock showed whales sent more than $493 million in a week.
Ethereum has since witnessed a recovery to above $4,067 as bulls took control following Trump’s win.
Analysts at Singapore-based QCP Capital say Bitcoin (BTC) and ETH are both at key levels despite the profit-taking deals at the critical $100K and $4k respectively. Options data for the 27 Dec. 2024 expiry indicates levels that “align with the highest open interest,” the analysts wrote.
Pointing to a potential squeeze higher, QCP analysts noted:
“History says ETH hits new highs in January post-halving. Options markets agree, where #ETH risk reversals favor calls starting in January.”
You might also like:
PEPE continues its rally despite whale selloff",https://crypto.news/whale-doubles-down-on-eth-with-7m-buy/?utm_source=CryptoNews&utm_medium=app,2024-12-09 22:10:12.773512,https://cnews24.ru/uploads/4e0/4e0f4adf9888abd1f8823fd77d913b474b5aa100.webp,Successfully Scraped
news/analytics/30202876/,Will Dogwifhat Price Hit $10 This December?,"Dogwifhat price, a Solana-based meme coin, has soared by 70% in the past month, gaining significant investor interest. Analysts now anticipate a potential breakout above the $10 mark, driving heightened optimism around the token’s bullish trajectory. The surge highlights growing confidence in the WIF market prospects, with its performance sparking widespread attention within the cryptocurrency community.",https://coingape.com/markets/will-dogwifhat-price-hit-10-this-december/?utm_source=CryptoNews&utm_medium=app,2024-12-09 22:10:13.176052,https://cnews24.ru/uploads/c76/c768a15ce2b193c02c462c377e39cae3d9dd6296.webp,Successfully Scraped
news/legal/30202879/,"SBF Working on Million-Dollar Memoir, FTX Victims to Get Royalty","Sam Bankman-Fried (SBF), the former billionaire and cofounder of the collapsed FTX crypto exchange, is reportedly drafting a prison memoir while serving a 25-year sentence at Brooklyn’s Metropolitan Detention Center (MDC). Bankman-Fried, who was convicted of fraud, has shared excerpts of his writings through his father, Joe Bankman, aiming to find a publisher for the project.
What will Happen to Royalties From FTX Founder’s Memoir?
Despite the memoir’s potential to secure a lucrative advance—estimated by a literary agent at seven figures—Bankman-Fried will not profit. As part of his sentencing, he faces an $11 billion forfeiture, which will prioritize compensating the FTX crypto exchange‘s victims. “The billions being restored during the bankruptcy process do not count,” a source noted.
The diary provides an intimate view of life behind bars and Bankman-Fried’s adaptation to harsh prison conditions. Among his grievances is the absence of basic comforts like pillows. “What the actual [expletive], we’re not allowed to have pillows? Are we allowed to sleep?” he wrote, according to a Forbes report.
Here, SBF is described how he traded two muffins for a makeshift pillow crafted from torn mattress stuffing. He also recounts losing the item during a cell raid. “I lost my pillow tonight. I’m now using towels and prison jumpsuits, but it doesn’t work. My neck already hurts.”
Advertisement
The writings delve into his relationships with fellow inmates, including one he nicknames “Harry,” a sports enthusiast who proposed a flawed betting strategy that Bankman-Fried calls “the gambler’s fallacy.” Reflecting on his cellmates’ behavior, he writes, “Most people become innies. They will go to war over a banana and trade everything to get high one more time.”
Closer Look at SBF’s Diary
He also explores the psychological toll of confinement. SBF remarked, “How can you be true to your true self when your true self has been deemed a danger to society so great you need to be locked in a cage?”
A notable section of the diary addresses the prevalence of a smuggled drug referred to as “deuce,” which SBF claims turns users into “zombies.” While denying any personal use, he describes the drug’s impact on prison life, including crackdowns by guards.
The diary also reflects on SBF’s childhood, highlighting a deep attachment to a stuffed dog named “Manfred,” which he often used as a pillow. “Ever since I got a stuffed dog when I was two years old, I’ve slept with him nearly every night of my life.”
Bankman-Fried’s motivations for publishing the memoir remain unclear. His father has enlisted the help of Walter Pavlo, a white-collar crime expert, to assist with the project. The writings, blending self-reflection and critique of prison life, offer a rare glimpse into the mind of the disgraced crypto magnate as he comes to terms with his downfall.",https://www.cryptonewsz.com/sbf-million-dollar-memoir-ftx-victims-royalty/?utm_source=CryptoNews&utm_medium=app,2024-12-09 22:10:13.566627,https://cnews24.ru/uploads/b34/b346825cf9d5d13a0d3b54f0e41fe58cca8ce7f8.webp,Successfully Scraped
news/analytics/30203079/,Crypto Crumbles in Broad Selloff Led 20% Declines Across Numerous Altcoins,"A slow bleed in crypto since late in the weekend accelerated into the early evening U.S. hours on Monday, leaving nearly the entirety of the sector sharply lower.
With prices in quick retreat, bitcoin (BTC) at press time had fallen back to just above $95,000, down about 5% over the past 24 hours. Ether (ETH) was down 10% to $3,590.
The broader CoinDesk 20 Index was lower by more than 8% over the same time frame, led by roughly 20% dives for Cardano (ADA), Avalanche (AVAX), and XRP (XRP).
Over $750 million worth of leveraged derivatives positions were liquidated across all digital assets over the past day, CoinGlass data shows, the ovewhelming majority of which were bullish bets. That puts today's flush almost on par with the August 5 crash and just trailing last Thursday's wild swing when BTC plunged to $90,000 from above $100,000.
Crypto liquidations (CoinGlass)
There are some signs of waning momentum on the crypto markets, including declining exchange volumes and heavy profit-taking by long-term holders, analytics firm 10x Research pointed out in a Monday morning note.
""This is likely to be only a brief consolidation phase before the bull market regains momentum,"" 10x Research founder Markus Thielen wrote in the report. ""However, traders should now pay close attention to which positions are outperforming and which are underperforming, as the rally enters a phase where not everything will continue to rise.
""To navigate this market effectively, traders should steer clear of weaker segments and focus on their core, high-conviction positions,"" he added.
Traders on the options markets are increasingly positioning themselves for sideways price action until year-end, taking profits on their earlier bullish bets and potentially rolling positions out to early next year, digital asset hedge fund QCP noted in a Monday morning report. ""Although we’re still structurally bullish, spot [price] is likely to range here for the remainder of the holiday season,"" the authors wrote.",https://www.coindesk.com/markets/2024/12/09/crypto-crumbles-in-broad-selloff-led-20-declines-across-numerous-altcoins?utm_source=CryptoNews&utm_medium=app,2024-12-09 21:10:14.405170,https://cnews24.ru/uploads/cc5/cc58a3efd2ec5d17fe33c05949a2c1c4c3844ec1_80.jpg,Successfully Scraped
news/mining/30202854/,Bitmain launches US production line to outmaneuver geopolitical trade tensions,"Bitcoin mining hardware giant Bitmain announced the launch of a new US-based production line, a strategic move aimed at mitigating delays caused by customs holds and navigating escalating trade tensions.
In a Dec. 9 statement, Bitmain highlighted the benefits of local production, stating:
“This strategic move aims to provide faster response times and more efficient services to North American customers.”
The first batch of US-made Antminer S21 Pro units is set to be delivered this December.
The decision follows reports of significant hold-ups by the US Customs and Border Protection (CBP), which has detained shipments of Bitmain’s Antminer devices over national security concerns linked to the company’s supply chain.
Supply chain challenges
The launch of US operations follows significant disruptions for American miners, who have faced delays of up to two months after CBP detained shipments of Bitmain’s S21 and T21 application-specific integrated circuits (ASICs). Some companies reported paying hundreds of thousands of dollars in storage fees while awaiting equipment release.
The delays are reportedly tied to concerns over Bitmain’s ties to chip designer Sophgo, which is under investigation by US authorities for alleged connections to Huawei.
Huawei, a focal point of US sanctions since 2019, has heightened scrutiny of Chinese tech companies. The investigation has left miners scrambling to secure critical equipment, exposing the risks of dependency on Chinese manufacturers.
Bitmain’s decision to produce ASICs domestically could alleviate these challenges, ensuring a more stable supply chain while avoiding potential tariffs expected under the incoming Trump administration. By shifting production to the US, Bitmain aims to maintain its dominance in the market while addressing the growing concerns of North American customers.
Strategic shift
The US has become a significant hub for Bitcoin mining, contributing a large share of the global hashrate. However, the industry’s reliance on Chinese-manufactured equipment has made it vulnerable to geopolitical and regulatory disruptions. Bitmain’s expansion into the US represents a proactive effort to reduce these risks and strengthen its competitive position in the region.
The rollout of the Antminer S21 Pro from the new US facility is expected to provide miners with a much-needed boost in efficiency and reduce operational uncertainty. Analysts note that Bitmain’s move also signals a broader industry trend of diversifying production locations to adapt to shifting trade and regulatory landscapes.
As the Trump administration prepares to take office, the implications for US-China trade policies and their impact on the crypto sector remain uncertain. For Bitmain and the broader mining community, the establishment of US-based production marks a critical step in navigating the challenges of a rapidly evolving market.",https://cryptoslate.com/bitmain-launches-us-production-line-to-outmaneuver-geopolitical-trade-tensions/?utm_source=CryptoNews&utm_medium=app,2024-12-09 21:10:14.811700,https://cnews24.ru/uploads/d8b/d8b6f9f026148e361ffa9f3ef4f414511e265592.jpg,Successfully Scraped
news/altcoins/30202851/,Elon Musk Retweets Pepe Meme; Influencing Pepecoin Price,"An hour ago, tech mogul and Tesla’s founder, Elon Musk retweeted a post based on the popular meme ‘Pepe the Frog’ meme, resulting in Pepecoin’s price fluctuation.
The meme coin surged to $0.0000277 with a marginal 0.81% hike in an hour amid growing expectations of a rally in Pepecoin.
An X user named Yaroslav working on xAI (Grok) shared an update on the project’s advancement. In one of his threads on X, he prompted the generative artificial intelligence model to draw a Pepe Van Gogh style.
pic.twitter.com/xw0DwdAtAO
— Yaroslav (@512×512) December 9, 2024
In response, the Grok shared four images of Pepe the Frog with different expressions and scenery. After a while, Elon Musk retweeted the post, with the smiling emoji.
Pepecoin Surges Amid Whale Accumulation
Advertisement
The meme coin surged over 150% in a month, lifting its price from $0.00001078 to $0.000028. The rally was mainly fueled by Donald Trump’s landmark victory in the U.S. presidential election in 2024.
Pepe has once again captured headlines, reaching its new all-time high of $0.000027 just hours ago. This achievement comes amidst significant market volatility, with the token delivering exceptional gains and outperforming many other crypto assets. The meteoric rise of Pepe is drawing substantial attention from both retail and institutional investors eager to ride the wave of its momentum.
The data reveals a remarkable development: whales collectively increased their Pepecoin holdings by $1.4 billion yesterday. This surge in accumulation by large investors often referred to as “smart money,” signals strong confidence in Pepe’s potential for continued growth.",https://www.cryptonewsz.com/elon-musk-retweets-pepe-meme-pepecoin-price/?utm_source=CryptoNews&utm_medium=app,2024-12-09 21:10:15.209683,https://cnews24.ru/uploads/c0b/c0b31d7f954fd6bf5dad40f4d77c19e8e610f6fc.webp,Successfully Scraped
news/analytics/30202732/,Binance CEO Richard Teng Makes a Statement for the End of 2024: He Talked About The Fate Of Cryptocurrencies After Trump,"Binance CEO Richard Teng shared his views on the evolving regulatory landscape for cryptocurrencies, especially under the potential influence of the Trump administration and its “crypto-friendly” stance, in a recent interview.
Teng touched on a wide range of topics, including Binance's compliance efforts, global market strategies, and the state of crypto adoption in regions like the Middle East.
The famous CEO noted that it was important for Donald Trump to select crypto-friendly figures for key roles such as SEC Chairman and crypto chief. Teng described 2024 as a turning point, pointing to milestones such as the price increase of Bitcoin, approval of ETFs for Bitcoin and Ethereum, and the increasing involvement of institutions such as BlackRock.
On the potential impact of Trump’s regulatory stance, Teng commented: “We now have a crypto-friendly president in America… This represents the most innovative technology for the future, and countries that adopt it will do very well.” However, he added that Binance continues to focus on compliance and global operations rather than engaging in political lobbying to influence regulatory decisions in the US.
Addressing Binance’s ongoing scrutiny by U.S. regulators, including the Department of Justice and the Treasury’s Financial Crimes Enforcement Network, Teng said the company is committed to compliance. “Compliance is the way to go,” Teng said, noting that Binance invested $230 million in compliance programs last year, a 30% increase from previous years.
Binance is currently licensed in over 20 countries, including India, Argentina, and several European countries. “We continue to work closely with U.S. watchdogs to further enhance our programs,” Teng said, describing compliance as a competitive advantage.
Speaking at Abu Dhabi Financial Week, Teng said the Middle East is growing in importance for Binance, citing high crypto adoption rates in the UAE, which are around 40%. He praised the region’s regulatory foresight, particularly Abu Dhabi’s early adoption of a crypto framework in 2018, positioning it as a global hub for blockchain and digital assets.
When asked about the U.S. market and the potential introduction of a stablecoin framework, Teng described the discussion as “premature.” Instead, he focused on Binance’s global growth, citing net inflows exceeding $20 billion this year and increasing institutional adoption. Teng also mentioned Binance’s $1 billion SAFU fund for user protection and ongoing efforts to combat scams and fraud.
As Binance navigates the evolving crypto landscape, Teng expressed optimism about the future of the industry, saying, “The future is extremely bright, especially as more countries, institutions, and sovereign wealth funds embrace digital assets.”
*This is not investment advice.",https://en.bitcoinsistemi.com/binance-ceo-richard-teng-makes-a-statement-for-the-end-of-2024-he-talked-about-the-fate-of-cryptocurrencies-after-trump/?utm_source=CryptoNews&utm_medium=app,2024-12-09 21:10:15.619632,https://cnews24.ru/uploads/30d/30dc806411ee731033416957cfabadb07aa8c6a7.jpeg,Successfully Scraped
