data_id,title,content,source_link,datetime_published,image_url,status
news/bitcoin/30203379/,From $100k to $250k? Analyzing Bitcoin’s bull market signals,"Who would have thought we’d see Bitcoin shoot through the roof this quickly, soaring past $100K, albeit retreating slightly at present?
As we move forward into 2025, the main question on our minds is: what lies ahead? Is Bitcoin (BTC) a bubble about to burst, or are we on track for $150,000–$200,000 soon? Are there any rational tools to predict its trajectory, or are we left to just play guessing games?
From what I’ve observed, the fog starts to lift when you examine on-chain and technical indicators, while also factoring in the macro perspective. Let’s layer these three types of analysis in this article to see what picture emerges for Bitcoin’s next move.
Table of Contents
Extreme greed, rising active addresses, and record hash rate
Weekly Golden Cross signals bull market with $150K-$250K potential
RSI signals overbought conditions, hints at pullback or consolidation
Fibonacci levels and Bollinger Bands signal key support and potential cooling
Visualizing Bitcoin’s market behavior through key indicators
Potential crypto space developments in 2025
Closing thoughts
Extreme greed, rising active addresses, and record hash rate
The Crypto Fear and Greed Index is currently at 78, indicating Extreme Greed, which often signals potential tops in the short term. However, sustained levels of extreme greed during bull markets often align with parabolic price increases before final peaks.
This typically precedes short-term pullbacks due to market exuberance, which appears to be what we’re witnessing now as Bitcoin’s price hovers around the $100K level.
Crypto Fear & Greed Index | Source: Alternative.me
The number of active addresses is increasing and, as of Dec. 8, stands at 855,153, suggesting heightened interest and usage of the Bitcoin network.
Number of active BTC addresses | Source: Glassnode
As of Dec. 9, 2024, Bitcoin’s hash rate is approximately 850.70 EH/s, reflecting a significant recovery from recent fluctuations but remaining below its all-time high of 949.98 EH/s, recorded on Nov. 26, 2024. While the current hash rate hasn’t yet reclaimed the ATH, this sustained strength reflects miner confidence and network security—long-term bullish signals. Bitcoin’s price tends to follow the hash rate; the more confident miners are about price appreciation, the less likely they are to sell.
BTC hash rate | Source: CoinWarz
Weekly Golden Cross signals bull market with $150K-$250K potential
The weekly Golden Cross, where the 50-week moving average crosses above the 200-week MA, is a highly significant signal for long-term investors because it often marks the start of major bull markets and the conclusion of prolonged bearish phases.
The previous instance of this signal occurred when Bitcoin recovered from the 2018 bear market and eventually surged to an all-time high of $69,000 in 2021.
Mirroring its behavior in previous bull cycles, this signal reappeared in early 2024 and preceded Bitcoin’s parabolic rise to its recent all-time high of $103,647. Previous bull cycles following weekly Golden Crosses have led to gains of 300%–600%.
If this pattern holds, Bitcoin could potentially reach $150,000 to $250,000 before the next major cycle correction. Meanwhile, the next Golden Cross is unlikely until 2026 or 2027, assuming Bitcoin undergoes a complete cycle of price appreciation, correction, and consolidation.
BTC Golden & Death Cross pattern | Source: TradingView
RSI signals overbought conditions, hints at pullback or consolidation
On the weekly timeframe, the Relative Strength Index is at 74.47, consistent with overbought conditions. However, this does not imply a trend reversal right away but rather reflects the possibility of a short-term pullback or a period of sideways price action.
In the past, many bull cycles saw similar RSI readings, followed by temporary pullbacks that were then succeeded by renewed rallies to higher highs.
In the 2021 bull cycle, the RSI reached similar levels multiple times before peaking above 90, after which Bitcoin experienced a significant correction. Assuming Bitcoin stays in the most recent consolidation range around $100K and the RSI retraces back to a healthier range of 60–65, the next leg upward could occur.
A healthy correction of 10%–20% or a sideways period would allow the markets to reset before experiencing sustained growth. For reference, a 10% correction from the all-time high of $103,647 would bring Bitcoin’s price to approximately $93,282.
Relative Strength Index | Source: TradingView
Fibonacci levels and Bollinger Bands signal key support and potential cooling
Fibonacci retracement levels, used in technical analysis to identify potential support and resistance zones, help indicate where a price might retrace before continuing its trend. Based on the chart below:
Key Levels:
$71,858 (0.618):
Major retracement level, acting as a strong support zone (a 30.67% pullback from the all-time high of $103,647).
$103,135 (0.786):
Significant resistance zone, near the all-time high.
Bitcoin’s price is currently trading slightly below the upper Bollinger Band, signaling strong bullish momentum. However, this position also indicates potential overextension, as prices often retrace or consolidate when deviating significantly from the midline (20-week simple moving average, currently at $71,858).
A pullback to $71,858 or further consolidation near the current price of $99,249 would represent a normal cooling-off period within the Bollinger Band framework and prepare the market for potential further gains.
Fibonacci retracement levels & Bollinger Bands | Source: TradingView
Visualizing Bitcoin’s market behavior through key indicators
To further visually represent Bitcoin’s market behavior, let’s look at this colored chart below. It includes a color-coded bar at the top that reflects RSI conditions. The currently visible purple and green color blocks suggest periods of oversold or bullish divergence, reflecting bullish momentum and aligning with RSI overbought levels.
The second bar shows market structure trends (e.g., ranging, bullish, or bearish). From the chart, we see green blocks that suggest the market is in a bullish phase, confirming breakout behavior.
Next, the main oscillator displays the Awesome Oscillator with divergences and pivot points, where the green peaks above zero and brown regions below confirm positive momentum and bullish pivots.
The secondary oscillator below the AO displays similar momentum indications, with positive bars (green above zero) suggesting accelerating upward momentum and a strong bullish bias.
Bitcoin Rainbow Indicators | Source: TradingView
Potential crypto space developments in 2025
Post-halving supply shock, increasing retail and institutional participation, institutional accumulation (companies like MicroStrategy and other corporate treasuries adopting Bitcoin as a strategic reserve asset) could push demand for it to new highs.
The proportion of institutional investors will likely grow, stabilizing price movements but also making Bitcoin more correlated with traditional markets.
Bitcoin’s dominance (currently around 55%) could rise further as investors favor its “digital gold” narrative over altcoins, especially if regulatory scrutiny tightens around smaller tokens.
Bitcoin wallet growth will continue as adoption in emerging markets increases, with Bitcoin used as a hedge against local currency devaluation.
Major corporations could start settling cross-border transactions in Bitcoin, while in regions with high inflation or de-dollarization trends central banks may increase interest in Bitcoin as a reserve asset.
Countries like the U.S., the EU, and the UAE are likely to finalize crypto-friendly regulations, while other jurisdictions may clamp down on decentralized finance and self-custody to maintain control over financial systems.
Closing thoughts
With a loud explosion of excitement, Bitcoin shattered the $100K barrier, an achievement deemed nothing short of astonishing. Technical indicators, including the weekly Golden Cross and RSI, point toward the possibility of further growth, with projections suggesting a potential climb to $150K–$250K in this bull cycle.
However, a healthy period of consolidation or correction would likely provide a stronger foundation for future price action. By 2025, Bitcoin may achieve what was once considered nearly impossible—establishing itself as a major player in the global financial system.",https://crypto.news/from-100k-to-250k-analyzing-bitcoins-bull-market-signals/?utm_source=CryptoNews&utm_medium=app,2024-12-10 00:10:03.146533,https://cnews24.ru/uploads/c69/c694e3d19f40c6e8c3a6d40b78c548864cd6262d.webp,Successfully Scraped
news/ethereum/30203447/,Will Historical Trends Push Ethereum Price to New Highs this December?,"Ethereum price takes a sharp 12.8% dive to breach the $3500 floor during Monday’s U.S. market session. The pullback was triggered by Bitcoin’s struggle to sustain above $100k and a massive $1.52 Billion liquidation across the crypto market. However, the retracement witnessed a surge in whale accumulation, signaling the potential for a bullish turnaround.
According to Coingecko, the global crypto market cap is at $3.6 Trillion with an intraday loss of 7%, while the 24-hour trading volume is at $483.2 Billion.
Key Highlights:
Ethereum price history suggests a bullish outlook for ETH holders in December.
ETH whale accumulation coincides with recent market upback, hints higher potential for reversal.
The crypto buyers could witness immediate resistance at $4,100 and $4,875.
Ethereum Price History in December Signals Optimism for Holders
A prominent crypto whale has added 1,800 ETH, valued at approximately $7 million, to their portfolio, according to on-chain data from Lookonchain. This latest acquisition has increased their holdings to a total of 39,600 ETH, worth around $99 million, since May 24.
The whale’s average purchase price for ETH stands at $2,487, positioning them with an impressive unrealized profit of $54 million. This strategic accumulation during the recent price hints the whale continues to follow the buying-the-dip sentiment with a belief in ETH’s future growth.
Historically, such accumulation has bolstered the cryptocurrency to find a bottom and rebound soon after.
A whale bought 1,800 $ETH($7M) again 3 hours ago!
This whale has accumulated 39,600 $ETH($99M) since May 24, with an average buying price of $2,487, and currently has an unrealized profit of ~$54M.https://t.co/OQ10QrT6IQ pic.twitter.com/FXiTMbbTse
— Lookonchain (@lookonchain) December 9, 2024
ETH Breaks 8-Month Resistance, Targets All-Time High
From the November low of $2,350 to $4,098, the Ethereum price showcased a high-momentum rally of 73%. An analysis of the daily chart shows the rally gave a decisive breakout from the resistance trendline of the 8-month correction, signaling the continuation of the prevailing uptrend.
Currently, the ETH price trades at $3,682 and is testing the breached trendline as support before taking the next leap. According to Coinglass data, Ethereum’s performance in December has historically been mixed. Over the years, the coin has experienced both gains and losses during these months.
ETH/USD -1d Chart
For example, notable returns were observed in 2020 (+19.46%) and 2017 (+70.54%), while there have also been significant declines, such as in 2021 (-20.61%) and 2019 (-15.09%).
However, December leans slightly on the bullish side, recording an average growth return of 7.95%.
ETH historical performance",https://www.cryptonewsz.com/historical-trends-ethereum-price-highs-december/?utm_source=CryptoNews&utm_medium=app,2024-12-10 00:10:03.528561,https://cnews24.ru/uploads/620/620772d3daafa03044bd53dee654705332600c1a.webp,Successfully Scraped
news/analytics/30203270/,"Bitcoin sees another flash crash, leading to $1.52 billion cascade in crypto liquidations","The crypto market experienced a cascade of liquidations over the past 24 hours, totaling $1.52 billion, as Bitcoin (BTC) underwent yet another flash crash.
According to Coinglass data, longs made up the vast majority of the amount, with $1.39 billion liquidated across the market, while short liquidations accounted for $137 million of the total.
This marks the second consecutive week of intense market volatility, with altcoins taking the hardest hit. Over $759 million in liquidations occurred in the past hour alone, highlighting the speed and scale of the sell-off.
Intense volatility
Based on CryptoSlate data, Bitcoin’s price dropped sharply to an intraday low of $94,129 before partially recovering to trade at roughly $97,000 as of press time.
The sudden downturn triggered liquidations of $83.99 million in Bitcoin positions within the last four hours, with long traders accounting for the majority. The liquidation of leveraged positions added further downward pressure, exacerbating losses across the broader market.
Ethereum (ETH) bore the brunt of the sell-off among altcoins, with $134.50 million liquidated in the last four hours alone. The asset’s price fell to $3,510, marking a sharp drop from its recent highs, before recovering to the $3,700 level as of press time.
Dogecoin (DOGE) also saw substantial liquidations, with $51.55 million wiped out as the meme coin struggled to hold above critical support levels and fell to an intraday low of $0.38 before recovering to $0.422 as of press time.
The top altcoin losers included Solana (SOL), which saw $33.61 million in liquidations, and XRP, which recorded $33.78 million in wiped-out positions. The two coins fell to $203 and $2.01, respectively, before buyers stepped in to drive a recovery to $220 and $2.26 as of press time.
Cardano (ADA) also faced significant pressure, dropping below key psychological levels to $0.91. As of press time, it is still hovering around the $1 level.
Over-leveraged positions
The rapid sell-off was fueled by a combination of over-leveraged positions, weak sentiment, and cascading stop-loss orders.
Binance accounted for the largest share of liquidations, with $417.65 million in total liquidations over the past four hours. OKX followed with $224.76 million, while Bybit saw $207.16 million in wiped-out positions.
The most significant single liquidation event occurred on Binance’s ETHUSDT trading pair, totaling $19.69 million.
Despite the massive liquidations and intense volatility, the crypto Fear and Greed Index remains in Extreme Greed territory at 78.
At the time of press
10:08 pm UTC on Dec. 9, 2024
, Bitcoin is ranked #1 by market cap and the price is
down
3.25%
over the past 24 hours. Bitcoin has a market capitalization of
$1.91 trillion
with a 24-hour trading volume of
$103.65 billion
.
Bitcoin
10:08 pm UTC on Dec. 9, 2024
$96,735.39
-3.25%
At the time of press
10:08 pm UTC on Dec. 9, 2024
, the total crypto market is valued at at
$3.44 trillion
with a 24-hour volume of
$288.18 billion
. Bitcoin dominance is currently at
55.69%
.",https://cryptoslate.com/bitcoin-sees-another-flash-crash-leading-to-1-52-billion-cascade-in-crypto-liquidations/?utm_source=CryptoNews&utm_medium=app,2024-12-09 23:10:04.028216,https://cnews24.ru/uploads/426/426d923c528a9802b7baba8fa53dbbd53f3c3a4e.jpg,Successfully Scraped
news/market/30203160/,Coinbase Faces Intense Backlash Over Account Restrictions Claims,"Coinbase Support has come under severe scrutiny as users on  X reported restricted access to their accounts. The backlash came after Coinbase claimed that a ‘minor increase’ in restricted accounts was due to prolonged inactivity and FUD (fear, uncertainty, and doubt) concerns.
However, hundreds of users have commented on the post, detailing how their accounts have been frozen for months and even years. Users on X also left a community note, saying Coinbase’s statement is false.
Coinbase Support Faces Major Scrutiny from Users
On Monday, December 9, Coinbase support acknowledged a significant rise in account activity, including new and reactivated users. The exchange claimed that it has led to a 2-3x increase in fraudulent attempts.
Coinbase said that the platform’s automated fraud-prevention method restricted some accounts due to a sudden spike in activity after last month’s election.
“We’ve seen a surge of new users and old users re-activating their accounts post-election. Along with this surge, as is typical with surges, we’ve seen a 2-3x increase in fraudulent attempts. This is causing a minor increase in restricted accounts and elevated CX wait times.” Coinbase wrote on X (formerly Twitter).
However, the crypto community has challenged Coinbase’s narrative. Users appended notes to Coinbase’s posts on X, accusing the company of misleading the public and confirming that account restrictions are widespread.
“This is not FUD.  My coinbase account has been locked for months, basically because I used a VPN once.  Every time I provide what is asked for, something else is needed,” one user named Kyle Brehm replied.
Many shared experiences of prolonged account freezes, some lasting years, with little to no explanation from Coinbase. Several users claimed their accounts were restricted after using VPNs or flagged for extended manual reviews. Some had suspended trading and withdrawals for months.
“My Coinbase account has been under manual review for more than a week.  Cannot trade, cannot withdrawal, all I can do is look and ask Compliance and the Help desk to resolve this.  No response to my inquiries?,” one user wrote.
The issue has sparked significant outrage, with hundreds of comments flooding Coinbase’s posts. The staggering number of complaints highlights the severity of customer dissatisfaction.
“I think I speak for everyone when I say Coinbase has a customer support problem. They should have a 24/7 customer service support line you can call and speak to a real person in a timely fashion about your account and get an answer and resolution. It should’ve be that difficult,” influencer and Dogecoin millionaire Glauber Contessoto posted today.
Coinbase’s struggles are not limited to user grievances. Recently, the exchange exited Turkey, closing its operations after withdrawing its application with the country’s regulator. This move mirrors challenges faced by other exchanges like Binance and KuCoin in managing Turkey’s regulatory environment.
In October, Coinbase faced another setback when a phishing scam led to a $6.5 million loss. A hacker impersonating Coinbase Support stole funds, laundered them through TON-linked wallets, and vanished after deleting social media accounts.
Despite these challenges, Coinbase experienced a financially strong 2024. Increased crypto trading and potential regulatory shifts in the US propelled the exchange’s stock to a 97% year-to-date gain.
Also, its layer-2 network, Base, achieved notable milestones. Base surpassed six million daily transactions in Q3 and is currently ranking as the fifth-largest blockchain by total value locked (TVL).",https://beincrypto.com/coinbase-support-account-restrictions-backlash/?utm_source=CryptoNews&utm_medium=app,2024-12-09 22:10:04.425683,https://cnews24.ru/uploads/aaf/aafbbe718148e7cbf7046c6ae92d6c56d3dca316.jpg,Successfully Scraped
news/altcoins/30203116/,Ethereum researcher Max Resnick makes surprise jump to Solana,"This is a segment from the Lightspeed newsletter. To read full editions,
subscribe
.
Max Resnick, who has in recent months become one of Ethereum’s more notable online figures, has joined Solana core development shop Anza, he announced on X today.
Resnick previously worked at a Consensys subsidiary named Special Mechanisms Group and became known for his contrarian beliefs on Ethereum’s roadmap — arguing that some thinking around layer-2s was misguided and Ethereum should focus on scaling the base layer. In classic crypto fashion, much of Resnick’s rising star originated on X: Kaito AI ranks him as having the 40th-highest mindshare on Crypto Twitter over the past three months.
Consensys is a software company started by Ethereum co-founder Joseph Lubin in 2014, and is perhaps best known for creating the MetaMask wallet. Anza is a Solana Labs spin-out that is responsible for continuing to develop the original Solana software.
The move was celebrated in the Solana world, where Resnick’s move to Solana was viewed as something of a coup. For Ethereum, Resnick doesn’t quite reach household name status like Justin Drake or Dankrad Feist do, but another high-profile defection following Resnick’s could certainly “raise some eyebrows,” said Paul Dylan-Ennis, a professor researching crypto at University College Dublin.
Resnick’s transition to Anza was helped along by Solana co-founder Anatoly Yakovenko, who encouraged the researcher to take the leap, Resnick shared with me today. The process started around three months ago. Resnick was also considering moves to Ethereum layer-2s or non-MetaMask crypto wallets.
Resnick said on X that he would be spending his first 100 days at Anza focusing on fee markets and consensus while getting up to speed on how Solana works at a core level. On a call today, Resnick added that his “moonshot” vision for Solana would be to add “multiple leaders” to the protocol.
On Ethereum and Solana today, one so-called leader is chosen to propose a block for validators to check. Under this model, the single leader has a “ton” of economic power which makes the protocols economically inefficient, Resnick said. Having multiple leaders compete to propose blocks could put downward pressure on how much economic value leaders can extract from validators.
Resnick credits himself with widening Ethereum’s overton window to allow for more serious conversations around how the layer-1 can scale, pointing out Ethereum Foundation researcher Dankrad Feist’s recent focus on scaling the L1 as an example.
But ultimately, Resnick sees Solana’s culture as more open to unconventional ideas, such as having multiple leaders — in comparison to Ethereum, which can tend to be bogged down by “political bullshit.”
“The ETH culture is really downstream of core development, and people who actually want to get things done are changing their personality, changing what they’re suggesting in order to make sure that they preserve political capital with the core dev community,” Resnick said.",https://blockworks.co/news/ethereum-researcher-joins-solana-anza?utm_source=CryptoNews&utm_medium=app,2024-12-09 22:10:05.299265,https://cnews24.ru/uploads/f20/f20fbc5da1f85a20f36e34b75b2308180d1ed779.jpg,Successfully Scraped
news/analytics/30203113/,Over $1.4 Billion in Liquidations as Bitcoin (BTC) Dumps by $6K in Hours,"Bitcoin’s latest price rejection at the coveted $100,000 mark has pushed the asset south hard, dumping by about six grand in hours.
The altcoins followed suit with massive losses from most of them, including double-digit price declines from WIF, TIA, FIL, APT, LTC, and others.
Shortly after
CryptoPotato’s
Market Watch from the morning, BTC actually went on the offensive and jumped above $100,000. However, that was short-lived, and the asset slumped below it almost immediately.
It lost a few grand and calmed at $98,000 in the following hours before the bears were able to take complete control of the market minutes ago and propelled a massive leg down.
In it, BTC’s price tumbled by four grand within an hour or so and dumped to a multi-day low of $94,300 (on Bitstamp). It managed to bounce off immediately and now sits close to $97,000, but the landscape is quite worrisome for over-leveraged traders.
Data from CoinGlass shows that the total value of wrecked positions in the past 24 hours has shot up to nearly $1.5 billion. Moreover, the number is close to $900 million in the last hour alone. More than 500,000 market participants have been wrecked in the past day.
The altcoins faced similar volatility, with numerous massive losers over the past 24 hours, as mentioned above. In fact, the single-largest wrecked position involved ETH and was worth nearly $20 million.
The total crypto market cap went from $3.750 trillion to under $3.5 trillion before it recovered some ground at $3.610 trillion as of press time.",https://cryptopotato.com/over-1-4-billion-in-liquidations-as-bitcoin-btc-dumps-by-6k-in-hours/?utm_source=CryptoNews&utm_medium=app,2024-12-09 22:10:05.679609,https://cnews24.ru/uploads/221/221310e09aa9e8b2ea7912a2c1c6c064cbcc7368.jpg,Successfully Scraped
