data_id,title,content,source_link,datetime_published,image_url,status
news/analytics/30202510/,AI predicts MultiversX (EGLD) price for year-end,"MultiversX (EGLD), formerly known as Elrond, is rapidly solidifying its position as one of the most technologically advanced blockchain platforms.
Currently trading at $49.70, EGLD has gained 10.8% over the past week and an impressive 71% over the last month, reflecting growing investor confidence.
Praised by Cyber Capital’s Justin Bons as the “technological Holy Grail of crypto,” MultiversX’s implementation of sharding positions it as a leader in scalability, achieving over 100,000 transactions per second.
This sets it apart from competitors like Bitcoin (BTC) and Ethereum (ETH), which rely on second-layer solutions to address scalability challenges.
Key fundamentals driving MultiversX’s growth
MultiversX’s capped token supply of 31.4 million, combined with its robust DeFi use cases and forthcoming upgrades like sub-second block times, continues to enhance its market appeal.
The platform offers users opportunities to earn passive income, generate yield, and benefit from features such as secure proof-of-stake, cross-chain interoperability, on-chain two-factor authentication, and opt-in gasless transactions, reinforcing its position as one of the most advanced blockchain platforms.
Strengthening its growth trajectory, MultiversX has forged a collaboration with Alibaba Cloud, paving the way for its strategic push into Asian markets.
This partnership aims to onboard Alibaba’s extensive customer base into the MultiversX ecosystem, a move with the potential to significantly expand its user adoption.
The impact of this collaboration is already evident, with EGLD gaining momentum on South Korea’s largest crypto exchange, Upbit, signaling notable progress in its market expansion efforts.
Further strengthening its momentum, EGLD’s inclusion in Coinbase’s COIN50 Index, which highlights promising cryptocurrencies, reflects growing institutional confidence.
This recognition was amplified on November 13, when Coinbase announced the listing and expansion of six new cryptocurrencies for New York citizens, with MultiversX being a notable addition.
This move aligns with the COIN50 Index rebalancing, positioning MultiversX as a key player in the evolving crypto market and setting the stage for further growth as the bull market unfolds.
AI predicts EGLD year-end price
To gauge EGLD’s future potential, Finbold leveraged market data and consulted ChatGPT-4o to analyze its prospects.
According to the artificial intelligence (AI) model, EGLD is projected to close 2024 trading between $60 and $70, driven by a combination of technological advancements, strategic partnerships, and bullish market sentiment.
However, in a bearish scenario influenced by market corrections or macroeconomic pressures, EGLD could retrace to the $40 to $45 range.
As MultiversX continues to expand its footprint through innovation and collaboration, its growing reputation as a leader in scalability and security sets the stage for sustained long-term growth.
Featured image from Shutterstock.",https://finbold.com/ai-predicts-multiversx-egld-price-for-year-end/?utm_source=CryptoNews&utm_medium=app,2024-12-09 20:10:22.968278,https://cnews24.ru/uploads/4a1/4a1a652cf03988b7168f9219e0700aacae87ec03.jpg,Successfully Scraped
news/legal/30202450/,What Paul Atkins as SEC Chair and David Sacks as Crypto Czar mean for the future of crypto,"With President-elect Donald Trump naming Paul Atkins as SEC Chair and venture capitalist David Sacks as the first-ever White House Crypto Czar, the crypto industry is poised for a seismic shift.
These appointments mark a significant departure from the SEC’s enforcement-heavy stance under Gary Gensler and signal the Trump administration’s intent to create a more industry-friendly regulatory environment.
Paul Atkins, a former SEC commissioner, is known for his pro-innovation stance and preference for self-regulation over heavy-handed enforcement.
His appointment has been met with optimism in the crypto sector, which frequently clashed with Gensler’s SEC.
Under Atkins’ leadership, a lighter regulatory touch is expected, with the potential shift of digital asset oversight to the CFTC, an agency seen as more crypto-friendly.
Meanwhile, David Sacks, a co-founder of Craft Ventures and former PayPal executive, brings a business-oriented approach to the newly created role of Crypto Czar.
Tasked with centralizing crypto policy and fostering collaboration across federal agencies, Sacks’ appointment could pave the way for the US to emerge as a global leader in crypto governance.
ETF approvals and enforcement actions
Under Atkins’ leadership, the SEC’s stance on ETF approvals is expected to become more favorable.
Michele Neitz, professor and founding director of the Center for Law, Tech, and Social Good at the University of San Francisco, believes approvals for ETFs like Solana’s will likely be expedited.
“An Atkins-led SEC will probably move more quickly on ETF approvals, focusing on investor protection and disclosure rather than the merit-neutral language we saw under Gensler,” Neitz said.
Additionally, Atkins is expected to shift the SEC’s approach to enforcement. Neitz predicts the agency may drop its appeal in the Ripple case and reconsider other high-profile enforcement actions, such as those against Coinbase.
The Crypto Czar
Charles Belle, a professor at the University of San Francisco, notes that the Crypto Czar role could position the US as a leader in global crypto governance.
“The Czar’s flexibility and direct contact with the Oval Office could drive harmonization of regulations across federal agencies and set global standards,” Belle said.
However, he cautions that the role’s lack of institutional resources could create conflicts with other government departments and lead to inconsistent policy implementation.
Balancing innovation with investor protection
Despite the optimism surrounding these appointments, Neitz underscores the importance of maintaining investor protections.
“While a new SEC chair will likely take a softer stance on crypto companies, it’s crucial to ensure that public protection remains a priority. Otherwise, we risk widespread consumer fraud and a backlash against lighter regulation,” she said.
The Financial Innovation and Technology Act, pending before Congress, could provide much-needed clarity by establishing federal definitions for digital assets.
According to Belle, this legislation could create a unified regulatory framework that promotes innovation while safeguarding consumers.
A new era for crypto?
The appointments of Atkins and Sacks signal a potential realignment of US crypto policy, shifting from punitive enforcement to collaborative innovation.
As the Trump administration takes shape, the crypto industry awaits a clearer regulatory framework that could finally unlock its full potential.
Belle emphasized that federal changes, including the introduction of a new Crypto Czar and new SEC leadership, should clarify regulations and provide consistency, enabling startups to thrive.
However, he cautioned that while federal baselines are necessary, lawmakers must avoid stifling state-led innovation.
State-led efforts have been vital for developing pro-crypto policies in places like Wyoming and consumer protection frameworks in California.",https://cryptobriefing.com/crypto-regulation-shift-sec-chairman/?utm_source=CryptoNews&utm_medium=app,2024-12-09 20:10:23.385788,https://cnews24.ru/uploads/804/804b0b6f683c0847cb89d5f22b551721dc0fc266.jpg,Successfully Scraped
news/legal/30202471/,Eric Trump: The U.S. can become a crypto superpower with ‘sensible’ regulation,"Eric Trump revealed to CNBC’s Dan Murphy in Abu Dhabi, United Arab Emirates, on December 9 that a set of “sensible” regulatory guidelines can help make the U.S. a cryptocurrency superpower.  He acknowledged the people in the crypto industry are fine with regulation, but they just want guidelines.
The son of president-elect Donald Trump also believes that his father intends to make America the crypto capital of the world on his return to the White House. Eric argued that the modern banking system is antiquated. He hopes that it’s just a matter of time before crypto not only catches up but leaps ahead.
Eric Trump sees America as the crypto capital of the world
The president-elect’s son was asked whether his father was considering regulatory or deregulatory measures in the crypto space and what the policies could look like in practice. He replied that the crypto space seems transparent.
Eric Trump added that the people in the crypto industry are frustrated that no one has ever put together a sensible plan for regulating an industry. He argued that the people in the crypto space are fine with regulation, but they just want guidelines, and they’ve said that.
Eric Trump also admitted they would have a clear road map and hoped the rest of the world would follow it.
Furthermore, Eric hopes that his father’s administration can lead by example as Americans look forward to becoming the crypto superpower of the world.
“I think America will be the crypto capital of the world. I fully support it. My father fully supports it. Our family, you know,  is fully embracing it. We believe in DeFi…We believe that’s the way of the future. And again, America, you know, better lead the way; otherwise, we’re going to leave a lot behind.”
– Eric Trump
Eric Trump wants to see a productive and efficient society
Eric described Elon Musk as the “modern-day Albert Einstein”. That’s because he believes Musk will play a big role in setting the White House’s policy agenda moving forward.
What’s more, Donald Trump named Musk and Vivek Ramaswamy as
co-leaders of an efficiency drive
that is poised to make substantial cuts to government spending, pare back regulation, and restructure agencies.
Eric Trump also revealed that Americans want to see efficiency, a productive society, and real innovation again. He added that they want to see the government step aside from great business and let businesses thrive, capitalism work, and the greatest democracy in the world do what it does.
However, the businessman admitted that America hasn’t been that way in the last four years but will return to its old glory. He hopes the billionaire technology leader will play a major role in ensuring that happens.
Donald Trump also recently announced plans to
nominate Paul Atkins
as chair of the Securities and Exchange Commission to replace Gary Gensler. Trump’s move to replace Gensler could tackle the agency’s regulation-by-enforcement approach to the crypto industry.
Eric Trump’s comments came shortly after Bitcoin’s price recently surged above $100,000 for the first time. Data from
CoinMarketCap
shows that the digital asset has experienced a 124% appreciation year-to-date and has dipped back to around $98,000 as of publication.
Bitcoin’s new milestone parallels the new U.S. administration’s plan to cement the crypto industry’s place in financial markets.
From Zero to Web3 Pro: Your 90-Day Career Launch Plan",https://www.cryptopolitan.com/eric-trump-usa-can-be-a-crypto-superpower/?utm_source=CryptoNews&utm_medium=app,2024-12-09 20:10:24.588968,https://cnews24.ru/uploads/2f4/2f4c56447a4e7e86012947cd077bce61265c716a.webp,Successfully Scraped
news/bitcoin/30202403/,Wrapped Bitcoin hides bitcoins for WBTC on Tron,"On August 9, BitGo announced that it was transitioning Wrapped Bitcoin (WBTC) to a new “strategic partnership between BitGo, Justin Sun, and the Tron Ecosystem.”
The announcement continued that this partner would would “continue to provide real-time proof-of-reserves.”
Despite specifically referencing the Tron ecosystem and promising that real-time proof-of-reserves would also continue, WBTC on TRON, as well as WETH on TRON, have been removed from the WBTC dashboard, meaning the proof-of-reserves for this token is no longer available.
The dashboard no longer includes WBTC on Tron but still features the versions on Ethereum, Base, Kava, and Osmosis.
An on-chain review of WBTC on Tron doesn’t show any substantial changes in the supply recently. However, it’s not currently possible to verify the
BTC that is meant to collateralize these tokens
.
Read more: Coinbase to delist WBTC months after Justin Sun controversy
These changes to WBTC come quick on the heels of Sun-advised HTX redeeming thousands of WBTC it hadn’t previously disclosed.
It’s not clear why WBTC made this change, especially as it continues to advertise on its homepage that it’s “Completely transparent. 100% verifiable.”
This change to not disclosing its backing brings WBTC on Tron in line with Sun-owned Poloniex’s BTC on Tron product. This product is approximately
1,000 times larger than WBTC on Tron
, makes up a massive portion of all BTC on HTX, and doesn’t disclose where the backing is held.
Protos has reached out to BitGo, BiT Global, WBTC, and Justin Sun but none responded immediately to questions about why these products were removed from the website.",https://protos.com/wrapped-bitcoin-hides-bitcoins-for-wbtc-on-tron/?utm_source=CryptoNews&utm_medium=app,2024-12-09 20:10:24.995282,https://cnews24.ru/uploads/78b/78bf4fdd6ede6013dd79ff1d5cdb293f1ee6bdb3.jpg,Successfully Scraped
news/bitcoin/30202363/,Bitcoin (BTC) Faces Weak Buying Pressure as Bulls Remain on the Sidelines,"Bitcoin (BTC) has seen a notable drop in buying pressure over the last few days as the cryptocurrency’s price continues to swing between $98,000 and $10,000. This drop in bullish momentum suggests that BTC might not be ready for its next leg up.
Instead, it indicates that the price might continue to trade sideways unless something changes.
Bitcoin Accumulation Lowers
One indicator showing a decline in Bitcoin buying pressure is the Stablecoin Supply Ratio (SSR). The SSR measures the ratio of a cryptocurrency’s market capitalization to the aggregated market capitalization of all stablecoins in circulation.
Low SSR indicates higher buying power from stablecoins. It suggests that there is a large amount of stablecoin liquidity available, which could drive upward price momentum if converted into cryptocurrency.High SSR, on the other hand, reflects lower stablecoin liquidity relative to the cryptocurrency’s market cap, potentially indicating weaker BTC buying power or limited demand.
According to CryptoQuant, the Bitcoin SSR has spiked to 18.29. The conditions stated above indicate that buying power is no longer strong. As such, Bitcoin’s price might continue to trade below its all-time high of $103,900.
Bitcoin Stablecoin Supply Ratio. Source: CryptoQuant
Another metric suggesting the same is the Bulls and Bears indicator. For context, bulls are addresses that bought at least 1% of the total trading volume within a specific period. Bears, on the flip side, are those who sold a similar amount.
When there are more bulls than bears, the BTC price is likely to increase. However, if bears have the upper hand, the opposite occurs. According to IntoTheBlock data, the number of bulls and bears over the last seven days has remained the same.
This indicates that Bitcoin bulls have refrained from buying more coins to raise the price. If this trend continues, then the BTC price might continue consolidating.
Bitcoin Bulls and Bears Indicator. Source: IntoTheBlock
BTC Price Prediction: Further Decline Looms
On the daily chart, the Moving Average Convergence Divergence (MACD) has dropped to the negative region. The MACD measures the momentum around a cryptocurrency.
When the MACD is positive, momentum is bullish. However, in this case, the momentum is bearish, suggesting that BTC’s price might not experience a significant uptrend in the short term. The indicator’s position also signifies a drop in Bitcoin buying pressure.
Bitcoin Daily Analysis. Source: TradingView
If this remains the same, Bitcoin’s price is likely to drop to $90,623. However, if buying pressure increases and bulls buy in large volumes, the coin price might jump to $103,581.",https://beincrypto.com/bitcoin-btc-faces-weak-buying-pressure/?utm_source=CryptoNews&utm_medium=app,2024-12-09 20:10:25.418624,https://cnews24.ru/uploads/401/401cdc3f246f86c59429f0a8144fdf05c857bd08.jpg,Successfully Scraped
news/blockchain/30202120/,"Drive-and-Earn Platform Dimo Swaps Ethereum Networks, From Polygon to Base","Dimo
, a platform for developers to build apps and enable car drivers to monetize their data, is migrating between Ethereum scaling networks, the developers exclusively told
Decrypt
—from Polygon to Coinbase’s Base. Co-founder Rob Solomon believes the move opens doors for valuable partnerships ahead.
The project is a “global API layer for cars” that is aiming to make every car on earth smart and programmable. This could manifest, the company says, in a future full of AI car mechanics and smart parking garages, as well as users making money when their data is sold.
Up until this point, Dimo has been building on
Ethereum
sidechain network
Polygon
. but has decided to make the switch to the Coinbase-incubated
Base layer-2 chain
. Solomon says this is largely motivated by the plethora of collaborations that could come as a result.
“Base is popular with builders [so] we could do deeper partnerships,” Solomon told
Decrypt
.
Meet the new DIMO
This is more than a fresh paint job — today marks the beginning of a new chapter. This winter will be filled with product updates, partnership launches, driving competitions, and giveaways that redefine DIMO. The journey to onboard a billion cars starts now. 🚘 pic.twitter.com/f3sdTFrmvX
— DIMO (@DIMO_Network) November 19, 2024
Specifically, he points to
Cario
, a project that offers car ownership titles on-chain, as a possible collaborator. As well as
Blackbird
, a restaurant loyalty company, that Dimo could connect with their food trucks or
Daylight
, a DePIN project for energy devices like car chargers.
Dimo’s migration is not expected to take place until “late 2025,” as the team is still in the process of scoping out the technical specifics of the move. Users of the platform will likely not have to do anything on their end, Solomon said; at most, it’d be the press of a button.
“We love Polygon and they're great,” the co-founder told
Decrypt
. “Base just makes a ton of sense for Dimo because of the inroads and credibility they have with the types of big enterprises that we partner with. They build great products that are optimized for Base (e.g. on-ramps, paymasters, wallet systems), and their community and technology are world-class.”
Created by Coinbase,
Base
is an Ethereum layer-2 scaling network that is the on-chain home for the major crypto exchange’s products. Given the prominent firm behind it, Base launched with dozens of projects committing to building and supporting the ecosystem—including oracle
Chainlink
, block explorer Etherscan, and DeFi protocol
Aave
.
This, Dimo believes, is a great foundation for the crypto project to achieve its long-term goal of becoming an integral part of every car company.
“In 1990, no companies built their workflow on the internet and email. Today, if those things disappeared, companies would fall apart overnight since they've come to depend on those protocols,” Solomon explained. “Dimo will be the same.”
He envisions a future where Dimo’s blockchain-based Vehicle ID system will replace the current system for
vehicle identification numbers
(VINs)—that help track things like warranty claims, insurance coverage, and more—which is typically stored in a
read-only database
.
“The blockchain will be the new de facto ledger for registrations and ownership,” he said. “All payments will be made on-chain. All credentials (insured, licensed, registered) will tie back cryptographically to on-chain identifiers.”
This future that Solomon outlines, he believes, will all be underpinned by Dimo’s technology becoming a crucial part of the future of the car industry. And this vision, the company believes, is more easily achieved on Base.
Edited by Andrew Hayward",https://decrypt.co/295607/drive-earn-platform-dimo-ethereum-polygon-base?utm_source=CryptoNews&utm_medium=app,2024-12-09 20:10:25.831534,https://cnews24.ru/uploads/59b/59b9bd238c15e015b2eaace7ee691c65d15a775a.png,Successfully Scraped
news/analytics/30202006/,Buy signal for two strong cryptocurrencies this week,"The cryptocurrency market continues to showcase its dynamic and volatile nature, drawing the attention of traders and investors navigating shifting trends and emerging opportunities.
While the global market cap has dipped by 2.8% to $3.82 trillion, bearish momentum prevails, with Bitcoin (BTC) and major altcoins experiencing declines.
Yet, amidst this market-wide consolidation, certain altcoins are defying the downturn, supported by robust momentum and strong technical indicators.
The average weekly Relative Strength Index (RSI) currently sits at 61.73, reflecting a neutral outlook, while the 24-hour RSI has climbed to 62.13, signaling renewed optimism for short-term opportunities.
Against this backdrop, some altcoins are standing out, showcasing compelling buy setups despite the market’s challenges.
Finbold turned to the RSI heatmap from
CoinGlass
on December 9 to identify altcoins poised for growth, presenting attractive opportunities for traders and investors in the current market climate.
Dogecoin (DOGE)
Dogecoin (DOGE) is currently flashing strong buy signals across key technical indicators, presenting a compelling opportunity for traders and investors.
With an average 24-hour RSI of 62.13, DOGE remains in a bullish momentum zone, signaling strength without entering overbought territory. The cryptocurrency has seen a minor 24-hour price dip of 2.52%, trading at $0.44838, which reflects a healthy correction rather than a trend reversal.
This dip presents an attractive entry point for those looking to capitalize on a potential upward move. Furthermore, the one-week RSI at 83.56 shows sustained buying interest over a longer timeframe, signaling strong market confidence.
Historically, DOGE has shown sharp rebounds following similar consolidations, with its technical indicators suggesting the potential for another rally.
Reinforcing this outlook, all major exponential and simple moving averages (from 10 to 200 periods) signal a “buy,” pointing to consistent upward momentum across different timeframes.
Supporting this, oscillators remain neutral, signaling stability and a lack of bearish pressure. The Average Directional Index (ADX) further validates the strength of DOGE’s current directional trend.
With a combination of bullish RSI levels, supportive moving averages, and a favorable market structure, DOGE offers a high-probability setup for traders and investors looking to capture short- to medium-term gains.
Enjin Coin (ENJ)
Enjin Coin (ENJ) also exhibits a strong buying opportunity supported by a solid technical foundation and favorable market dynamics.
With a 24-hour RSI of 64.46, ENJ outperforms the market average RSI of 62.13, indicating sustained bullish momentum while remaining below the overbought threshold of 70.
This suggests the potential for further upward movement, making ENJ an attractive prospect in the current market environment.
The technical outlook is further reinforced by 11 out of 14 moving average indicators signaling a “buy.” Key moving averages, such as the 50 EMA, 100 EMA, and 200 EMA, are significantly below ENJ’s current price of $0.33883, providing robust support and highlighting consistent upward momentum across short-, medium-, and long-term timeframes.
This alignment of moving averages underscores the asset’s favorable trajectory and enhances its appeal for both traders and investors.
Although ENJ has experienced a 6.53% price decline over the past 24 hours, this correction presents a compelling entry point for those seeking to capitalize on its next potential rebound.
Corrections of this nature are often followed by upward movement, particularly when supported by strong technical indicators.
Meanwhile, oscillators remain neutral, signaling market stability and a lack of significant bearish pressure. Short-term momentum indicators, including the MACD also exhibit mild bearish signals, which warrant close monitoring.
However, the broader technical framework strongly favors bullish continuation, positioning ENJ as an asset with significant potential for medium- to long-term gains.
While these cryptocurrencies demonstrate strong momentum and robust technical support, it’s important to acknowledge that short-term market fluctuations could influence their trajectories.
Investors are encouraged to approach these opportunities with caution, perform comprehensive research, and ensure their investment strategies align with their risk tolerance and long-term financial objectives.
Featured image via Shutterstock.",https://finbold.com/buy-signal-for-two-strong-cryptocurrencies-this-week-15/?utm_source=CryptoNews&utm_medium=app,2024-12-09 20:10:26.232943,https://cnews24.ru/uploads/82b/82b4d800cf06a0e4f12c22ea4e8324749c908305.jpg,Successfully Scraped
